date,score,scoreText,title,text,replyDate,replyText,version,thumbsUp,criterias/0/criteria,criterias/0/rating,criterias/1/criteria,criterias/1/rating,criterias/2/criteria,criterias/2/rating
2022-07-20T09:59:10.656Z,5,5,,"Tenho faz tempo esse aplicativo, eu gosto pq me fala certinho qdo vou ficar menstruada ,uma vez que parei de tomar anticoncepcional pq tive trombose a 3 anos, fiquei perdida de qdo iria descer pra mim. Foi qdo minha filha falou desse aplicativo que adorei e tenho até hoje. **Claro que não começo não era tão certeiro no dia que iria mestruar, mas agora acerta na mosca. Kkkk. Recomendo.",,,70.0,0,,,,,,
2022-08-09T00:12:55.870Z,5,5,,App perfeito para ajudar a controlar o ciclo.,,,70.0,0,vaf_phase1_strength_training,3,vaf_never_display_inappropriate_ads,2,vaf_phase1_personal_coaching,2
2022-08-08T07:49:45.298Z,5,5,,Ele me ajudar a ter um cronograma e é excelente .,,,70.0,0,,,,,,
2022-08-11T18:55:45.543Z,5,5,,"O app é pft, mas ele para de funcionar na hora de monitorar os sintomas",,,70.0,0,,,,,,
2022-08-07T03:57:56.617Z,2,2,,"Estou excluindo o aplicativo devido ao mesmo além de apoiar, incentiva o aborto. Eu sou contra.",,,70.0,0,,,,,,
2022-08-11T01:44:25.280Z,5,5,,É ótimo para melhor acompanhamento do ciclo.,,,70.0,0,vaf_never_display_positive_impact,1,vaf_phase1_fitness_devices,1,vaf_phase1_verbal_feedback,1
2022-07-29T20:58:35.818Z,3,3,,Não manda notificações e não marca meu período fertil no calendario mesmo eu selecionando pra mostrar,2022-08-02T09:41:08.832Z,"Olá, alguns dispositivos Android vêm com configurações ativas, que impedem que as notificações de alguns aplicativos funcionem corretamente. Uma solução simples seria verificares isto no teu dispositivo e observar se essa função está ativa. Para mais ajuda contata-nos diretamente através de support.helloclue.com/hc/pt. Atenciosamente, Clue.",70.0,0,,,,,,
2022-08-18T16:40:19.189Z,5,5,,"Um ótimo aplicativo consigo acompanhar meus períodos sem errro,super recomendo...obg",,,70.0,0,,,,,,
2022-07-22T23:21:27.641Z,4,4,,"Aplicativo muito bom, sempre acerta a data da minha proxima menstruação!",,,70.0,0,,,,,,
2022-08-23T02:36:45.243Z,4,4,,Ele e muito bom não tem anúncios sempre mim lembra quando vem dever . . . . .,,,70.0,0,,,,,,
2022-08-01T01:28:02.140Z,3,3,,"Era bom Antes do ""Plus"", quando não cobrava pra dar as mesmas informações que o google;)",2022-08-02T09:56:28.924Z,"Agradecemos o contato. Lamentamos saber que a aplicação Clue não tenha atingido as tuas expectativas. Procuramos sempre por melhorar, por isso gostaríamos de ouvir mais feedback da tua parte. Podes contactar-nos através de support.helloclue.com/hc/pt. Atenciosamente, Clue.",70.0,0,,,,,,
2022-07-30T16:30:15.817Z,5,5,,"Uso há anos! Já testei vários, esse é o melhor sem sombra de dúvidas",,,70.0,0,vaf_never_display_difficult_to_use,1,vaf_phase1_importing_recipes,2,vaf_phase1_3rd_party_music,2
2022-08-11T16:16:53.322Z,5,5,,Ajuda muito para você saber mais sobre seu ciclo e outras coisas também.,,,70.0,0,vaf_never_display_ads_experience,,vaf_never_display_ease_of_use,,,
2022-08-21T19:38:04.385Z,5,5,,"Ótimo aplicativo, com informações relevantes, recomendo",,,70.0,0,,,,,,
2022-08-05T02:08:18.132Z,5,5,,"Sempre usei ele ,muito certinho no dia de aviso gosto muito",,,70.0,0,vaf_never_display_difficult_to_use,2,vaf_phase1_smartwatch_support,2,vaf_phase1_offline_viewing,1
2022-08-21T13:58:47.389Z,5,5,,Muito bom. Fácil de usar e muito útil. Recomendo demais.,,,70.0,0,vaf_phase1_gps_tracking,3,vaf_phase1_real_time_following,3,vaf_never_display_meet_expectations,1
2022-08-23T16:56:26.632Z,5,5,,Um ótimo app pra quem tem a menstruação regulada eu tenho a minha desregulada mas serve pra lembrar da última menstruação,,,70.0,0,vaf_never_display_ease_of_use,,vaf_never_display_ads_experience,,,
2022-08-27T01:50:59.607Z,5,5,,Melhor app da vida! 26/08/2022: continua sendo o melhor app da vida.,,,70.0,0,vaf_never_display_make_you_happy,1,,,,
2022-08-13T19:58:43.999Z,5,5,,Excelente aplicativo. Uso há 4 anos e amo muito. ❤️,,,70.0,0,vaf_phase1_offline_logging,1,vaf_never_display_disruptive_ads,2,vaf_never_display_easy_to_use,1
2022-08-07T19:45:53.364Z,5,5,,"Muito bom, desde quando comecei a usar, tem ajudado muito a entender o meu ciclo",,,70.0,0,,,,,,
2022-08-21T23:32:52.939Z,5,5,,"App muito bom, vem me ajudando a conhecer mais meu ciclo menstrual.",,,70.0,0,vaf_never_display_ads_experience,,vaf_never_display_ease_of_use,,,
2022-08-08T13:48:34.727Z,5,5,,É um aplicativo q me acompanha desde muito tempo. Excelente.,,,70.0,0,,,,,,
2022-08-15T10:30:41.418Z,5,5,,Muito bom para monitoramento.,,,70.0,0,,,,,,
2022-08-23T03:15:59.564Z,5,5,,Melhor app para monitorar seu ciclo,,,70.0,0,,,,,,
2022-08-17T15:03:32.123Z,5,5,,"Melhor app da categoria, uso à anos e recomendo!",,,70.0,0,vaf_phase1_offline_logging,1,vaf_phase1_tracking_workouts,2,vaf_phase1_workout_diary,2
2022-08-23T15:46:29.430Z,5,5,,Melhor app para controle do ciclo menstrual que eu já vi !,,,70.0,0,,,,,,
2022-08-24T19:43:43.746Z,5,5,,Melhor aplicativo para monitorar ciclo menstrual,,,70.0,0,,,,,,
2022-07-19T16:26:50.949Z,5,5,,Tenho o app a quase 4 anos é sempre foi certo com oq mostrava.,,,70.0,0,vaf_phase1_period_tracking,1,vaf_never_display_app_description,1,vaf_never_display_visually_good,1
2022-07-19T11:48:27.945Z,5,5,,Ótimo app te ajuda muito de várias formas,,,70.0,0,,,,,,
2022-07-17T13:46:06.491Z,5,5,,amo este aplicativo 😍 ele me ajuda demais a entender e acompanhar o meu ciclo!,,,70.0,0,vaf_never_display_ads_experience,,vaf_never_display_ease_of_use,,,
2022-07-25T16:18:23.794Z,5,5,,"App maravilhoso, me ajuda demais a acompanhar meu ciclo",,,70.0,0,,,,,,
2022-07-30T09:55:58.360Z,5,5,,Melhor aplicativo para o ciclo menstrual,,,70.0,0,,,,,,
2022-07-30T14:11:17.551Z,5,5,,Eu gosto bastante. Graças a ele consigo acompanhar meu ciclo.,,,70.0,0,,,,,,
2022-08-01T20:36:37.612Z,5,5,,Perfeito para monitorar o ciclo,,,70.0,0,,,,,,
2022-07-22T05:10:17.142Z,5,5,,"Nada a reclamar ,sempre me ajudando mesmo na forma gratuita de utilizar.",,,70.0,0,vaf_phase1_real_time_following,3,vaf_never_display_visually_good,3,vaf_phase1_leaderboards,3
2022-08-07T11:55:40.121Z,4,4,,"Amei mt o app,só não dei 5 estrelas pois não consigo usar sem net :(",2022-08-10T15:02:11.515Z,"Olá, agradecemos o contato. O feedback dos nossos utilizadores é muito importante para nós. Algumas funcionalidades ficam indisponíveis em modo offline no Clue. Para que possamos entender melhor o problema e ajudar-te, aconselhamos que nos escrevas diretamente através de support.helloclue.com/hc/pt. Atenciosamente, Clue.",70.0,0,,,,,,
2022-07-27T21:00:53.723Z,5,5,,Gosto muito e me ajuda no comtrole da tpm,,,70.0,0,vaf_phase1_lockscreen_display,3,vaf_phase1_tracking_weight,3,vaf_never_display_disruptive_ads,2
2022-07-19T19:01:30.562Z,5,5,,Amo o Clue...me ajuda a guardar e anotar sintomas e monitoramento do meu ciclo!!,,,70.0,0,,,,,,
2022-08-09T18:51:37.311Z,5,5,,"App perfeito, estou amando.",,,70.0,0,vaf_never_display_difficult_to_use,2,vaf_phase1_track_fitness_activities,1,vaf_phase1_guide_exercise,1
2022-07-28T11:10:18.468Z,5,5,,"Gosto muito desse aplicativo,me ajuda muito.",,,70.0,0,,,,,,
2022-07-29T01:55:12.811Z,5,5,,App perfeito! Uso há anos👏🏼👏🏼👏🏼,,,70.0,0,vaf_never_display_content_language,1,vaf_phase1_tracking_weight,3,,
2022-08-17T00:13:54.970Z,5,5,,Comecei a poucos meses muito bom!!!,,,70.0,0,,,,,,
2022-07-20T22:10:18.140Z,5,5,,"Melhor app da minha vida, há mais de 3 anos usando.",,,70.0,0,vaf_phase1_training_community,1,,,,
2022-07-19T01:20:38.831Z,5,5,,Tá sendo muito útil e maravilhoso,,,70.0,0,,,,,,
2022-08-03T02:13:39.641Z,5,5,,"Muito bom, uso o app a anos já, recomendo!",,,70.0,0,,,,,,
2022-07-21T21:09:00.401Z,5,5,,Meu app favorito pra acompanhar. Bem completo,,,70.0,0,vaf_never_display_ease_of_use,,vaf_never_display_ads_experience,,,
2022-08-08T21:02:41.199Z,5,5,,Melhor aplicativo para controle,,,70.0,0,vaf_never_display_ease_of_use,,vaf_never_display_ads_experience,,,
2022-08-27T01:53:01.931Z,5,5,,É um aplicativo que me ajuda a entender claramente o meu ciclo.,,,70.0,0,vaf_never_display_visually_bad,2,vaf_never_display_disruptive_ads,2,vaf_never_display_difficult_to_use,2
2022-08-10T10:26:43.904Z,5,5,,Ótimo aplicativo na versão gratuita,,,70.0,0,,,,,,
2022-08-16T19:51:37.369Z,5,5,,"Maravilhoso,já tenho o app faz alguns anos!",,,70.0,0,,,,,,
2022-08-02T21:50:48.239Z,5,5,,"App perfeito, amei 😍",,,70.0,0,,,,,,
2022-08-10T02:12:40.115Z,5,5,,"Tenho a alguns anos, nunca deu problema",,,70.0,0,vaf_never_display_ease_of_use,,vaf_never_display_ads_experience,,,
2022-08-12T01:43:43.904Z,5,5,,"Muito bom, meu companheiro de anos!!",,,70.0,0,,,,,,
2022-08-09T19:43:30.950Z,1,1,,App apoia o aborto ! Pessimo,,,70.0,1,,,,,,
2022-08-19T00:31:31.371Z,5,5,,"muito bom, me ajuda bastante",,,70.0,0,,,,,,
2022-08-15T01:31:20.190Z,5,5,,Muito bom o app!,,,70.0,0,,,,,,
2022-08-16T18:01:07.508Z,5,5,,Muito bom e útil,,,70.0,0,vaf_phase1_period_tracking,1,vaf_phase1_workout_diary,2,vaf_never_display_spend_more_time,3
2022-08-11T16:12:16.242Z,5,5,,"App ótimo, uso muito",,,70.0,0,,,,,,
2022-08-02T11:58:34.289Z,5,5,,Muito bom podem baixar,,,70.0,0,,,,,,
2022-08-26T02:41:19.733Z,5,5,,"Muito bom, excelente",,,70.0,0,,,,,,
2022-07-23T02:36:45.354Z,5,5,,Melhor do mundo não tem igual ao clue!!!!!,,,70.0,0,vaf_phase1_smartwatch_support,2,vaf_never_display_make_you_happy,1,vaf_phase1_voice_coach,2
2022-08-18T19:33:41.185Z,5,5,,MUUITO BOM precisava desse app,,,70.0,0,,,,,,
2022-07-25T01:39:56.727Z,5,5,,"Eu adoro, me ajuda muito. Uso sempre.",,,70.0,0,,,,,,
2022-07-30T02:07:00.931Z,5,5,,O aplicativo é muito bom mesmo gostei muito.😉,,,70.0,0,,,,,,
2022-07-14T21:18:51.260Z,5,5,,ESSE APP É MARAVILHOSO!!!!SUBARASHI ME SEGUE:@123LCCS (INSTAGRAM),,,70.0,0,,,,,,
2022-07-18T14:01:04.122Z,5,5,,Muito bom! Prático e fácil,,,70.0,0,,,,,,
2022-07-26T21:12:23.356Z,5,5,,Maravilhoso e ajuda bastante,,,70.0,0,,,,,,
2022-07-18T16:08:05.157Z,5,5,,App maravilhoso super indico,,,70.0,0,,,,,,
2022-07-27T20:39:22.350Z,5,5,,Ele é ótimo nenhum defeito,,,70.0,0,,,,,,
2022-07-25T02:21:25.402Z,5,5,,"ótimo, me ajudou muito",,,70.0,0,,,,,,
2022-07-26T22:52:15.308Z,5,5,,Ótimo super inteligente,,,70.0,0,,,,,,
2022-08-23T23:03:34.329Z,5,5,,Ele é bem acertivo,,,70.0,0,,,,,,
2022-08-12T12:36:01.448Z,5,5,,Tens Me Ajudado Muito e E Bem Fácil Monitorar Gst De Mais Desse App E Olha Q Foi Meu NamoradoQ Me Indicou,,,70.0,0,,,,,,
2022-08-19T23:01:36.895Z,5,5,,Esta me ajudando muito 👏👏,,,70.0,0,vaf_never_display_ease_of_use,,vaf_never_display_ads_experience,,,
2022-08-17T17:55:23.156Z,5,5,,Amei 💖 O melhor calendário menstrual do mundo 💟 Nota 1.000,,,70.0,0,vaf_phase1_voice_controls,2,vaf_never_display_negative_ads_impact,2,vaf_phase1_cardio_training,2
2022-08-05T18:12:36.598Z,5,5,,Ele tá me ajudando muito,,,70.0,0,,,,,,
2022-08-07T23:34:15.665Z,5,5,,Amei o aplicativo e otimo❤,,,70.0,0,,,,,,
2022-07-20T22:14:51.460Z,5,5,,Eu amei muito eficiente,,,70.0,0,,,,,,
2022-07-31T11:12:36.106Z,5,5,,App muito bom,,,70.0,0,,,,,,
